<?xml version="1.0" encoding="UTF-8"?>
<ciudades  xmlns:xsi="http://www.w3.org/2001/XMLSchema-instance" xsi:noNamespaceSchemaLocation="Paises.xsd" >
  <ciudad>
    <nombre>Nueva Delhi</nombre>
    <pais continente="asia">India</pais>
  </ciudad>
  <ciudad>
    <nombre>Lisboa</nombre>
    <pais continente="europa">Portugal</pais>
  </ciudad>
  <ciudad>
    <nombre>El Cairo</nombre>
    <pais continente="africa">Egipto</pais>
  </ciudad>
</ciudades>
